{
    "$schema": "http://json-schema.org/draft-07/schema#",
    "title": "Subcategory",
    "type": "object",
    "required": ["id", "categoryId", "title", "description", "sections"],
    "properties": {
      "id": {
        "type": "string",
        "pattern": "^[a-z0-9-]+$",
        "description": "Unique identifier for the subcategory"
      },
      "categoryId": {
        "type": "string",
        "pattern": "^[a-z0-9-]+$",
        "description": "ID of the parent category"
      },
      "title": {
        "type": "string",
        "description": "Display name of the subcategory"
      },
      "description": {
        "type": "string",
        "description": "Detailed description of the subcategory"
      },
      "sections": {
        "type": "array",
        "items": {
          "type": "object",
          "required": ["id", "title", "description"],
          "properties": {
            "id": {
              "type": "string",
              "pattern": "^[a-z0-9-]+$"
            },
            "title": {
              "type": "string"
            },
            "description": {
              "type": "string"
            }
          }
        },
        "description": "Sections within this subcategory"
      },
      "bestPractices": {
        "type": "array",
        "items": {
          "type": "string"
        },
        "description": "Best practices for this technology"
      },
      "integrations": {
        "type": "array",
        "items": {
          "type": "string"
        },
        "description": "Integration points with other systems"
      },
      "resources": {
        "type": "array",
        "items": {
          "type": "object",
          "required": ["title", "url", "type"],
          "properties": {
            "title": {
              "type": "string"
            },
            "url": {
              "type": "string",
              "format": "uri"
            },
            "type": {
              "type": "string",
              "enum": ["documentation", "article", "book", "course", "community", "video", "tool"]
            }
          }
        }
      },
      "faqs": {
        "type": "array",
        "items": {
          "type": "object",
          "required": ["question", "answer"],
          "properties": {
            "question": {
              "type": "string"
            },
            "answer": {
              "type": "string"
            }
          }
        }
      },
      "glossary": {
        "type": "array",
        "items": {
          "type": "object",
          "required": ["term", "definition"],
          "properties": {
            "term": {
              "type": "string"
            },
            "definition": {
              "type": "string"
            }
          }
        }
      }
    }
  }