{
    "id": "cloud-management",
    "categoryId": "cloud",
    "title": "Cloud Management & Optimization",
    "description": "Cloud management and optimization tools help organizations control their cloud environments by providing visibility, governance, cost management, and performance optimization across cloud resources, enabling better decision-making and operational efficiency.",
    "sections": [
      {
        "id": "cloud-cost",
        "title": "Cloud Cost Management",
        "description": "Tools for monitoring, analyzing, and optimizing cloud spending"
      },
      {
        "id": "cloud-security",
        "title": "Cloud Security & Compliance",
        "description": "Solutions for securing cloud environments and ensuring compliance with regulations"
      },
      {
        "id": "cloud-automation",
        "title": "Cloud Automation & Orchestration",
        "description": "Tools for automating cloud operations and workflows"
      },
      {
        "id": "cloud-monitoring",
        "title": "Cloud Monitoring & Performance",
        "description": "Solutions for monitoring cloud infrastructure and application performance"
      }
    ],
    "bestPractices": [
      "**Resource Tagging**: Implement consistent tagging for resources to enable detailed cost allocation and governance",
      "**Right-sizing**: Continuously evaluate and optimize resource sizes based on actual usage patterns",
      "**Reserved Instances**: Use reserved or committed-use instances for predictable workloads to reduce costs",
      "**Auto-scaling**: Implement auto-scaling to match resource allocation with demand",
      "**Policy-based Management**: Create and enforce governance policies for cloud resource usage",
      "**Cloud Center of Excellence**: Establish a cross-functional team to govern cloud adoption and best practices",
      "**Automated Remediation**: Set up automated responses to security events and cost anomalies",
      "**Continuous Compliance**: Regularly verify compliance with standards and regulations"
    ],
    "integrations": [
      "**Financial Systems**: Integrate with billing and financial management systems for chargeback and showback",
      "**ITSM Tools**: Connect with IT service management platforms for workflow automation",
      "**SIEM Solutions**: Feed cloud security data into security information and event management systems",
      "**Monitoring Platforms**: Feed cloud metrics into centralized monitoring and dashboard tools",
      "**Identity Providers**: Integrate with identity and access management systems"
    ],
    "resources": [
      {
        "title": "FinOps Framework",
        "url": "https://www.finops.org/introduction/what-is-finops/",
        "type": "documentation"
      },
      {
        "title": "Cloud Security Alliance Best Practices",
        "url": "https://cloudsecurityalliance.org/research/guidance/",
        "type": "documentation"
      },
      {
        "title": "Cloud Management Platforms Market Guide",
        "url": "https://www.gartner.com/en/documents/3992584/market-guide-for-cloud-management-platforms",
        "type": "article"
      },
      {
        "title": "Cloud Cost Management Best Practices",
        "url": "https://cloud.google.com/blog/products/cloud-migration-solutions/best-practices-for-cloud-cost-optimization",
        "type": "article"
      },
      {
        "title": "Cloud Operations Excellence",
        "url": "https://aws.amazon.com/architecture/well-architected/?wa-lens-whitepapers.sort-by=item.additionalFields.sortDate&wa-lens-whitepapers.sort-order=desc",
        "type": "documentation"
      }
    ]
  }