{
    "id": "private-cloud",
    "categoryId": "cloud",
    "title": "Private Cloud Solutions",
    "description": "Private cloud solutions deliver cloud computing features exclusively to a single organization, either on-premises or in a service provider's data center, offering greater control, security, and customization for enterprises with specific compliance or performance requirements.",
    "sections": [
      {
        "id": "private-platforms",
        "title": "Private Cloud Platforms",
        "description": "Comprehensive platforms for building and managing private cloud environments"
      },
      {
        "id": "virtualization",
        "title": "Virtualization Technologies",
        "description": "Technologies that enable server virtualization for private cloud deployments"
      },
      {
        "id": "cloud-software",
        "title": "Cloud Infrastructure Software",
        "description": "Software solutions for creating cloud capabilities on standard hardware"
      },
      {
        "id": "hosted-private-cloud",
        "title": "Hosted Private Cloud",
        "description": "Provider-managed private cloud services hosted in dedicated environments"
      }
    ],
    "bestPractices": [
      "**Standardization**: Create standardized infrastructure templates and service catalogs",
      "**Automation**: Implement automation for provisioning, scaling, and lifecycle management",
      "**Resource Pooling**: Pool computing resources to maximize utilization and efficiency",
      "**Self-service**: Provide self-service portals for authorized users to request resources",
      "**Monitoring**: Implement comprehensive monitoring for performance, capacity, and security",
      "**Chargeback**: Track resource usage for departmental billing or showback",
      "**Disaster Recovery**: Plan for business continuity with appropriate backup and recovery mechanisms",
      "**Capacity Planning**: Regularly review resource utilization and plan for future needs"
    ],
    "integrations": [
      "**Network Infrastructure**: Integration with existing networking equipment and SDN solutions",
      "**Identity Systems**: Authentication and authorization linked with enterprise identity providers",
      "**Monitoring Tools**: Integration with existing monitoring and management solutions",
      "**DevOps Tools**: CI/CD pipelines and infrastructure as code tools",
      "**Public Cloud Services**: Hybrid connections to public cloud providers for additional capacity"
    ],
    "resources": [
      {
        "title": "OpenStack Architecture Design Guide",
        "url": "https://docs.openstack.org/arch-design/",
        "type": "documentation"
      },
      {
        "title": "VMware Cloud Foundation Documentation",
        "url": "https://docs.vmware.com/en/VMware-Cloud-Foundation/",
        "type": "documentation"
      },
      {
        "title": "Building a Private Cloud with OpenStack",
        "url": "https://www.oreilly.com/library/view/deploying-openstack/9781491971116/",
        "type": "book"
      },
      {
        "title": "Red Hat OpenStack Platform Documentation",
        "url": "https://access.redhat.com/documentation/en-us/red_hat_openstack_platform/",
        "type": "documentation"
      },
      {
        "title": "Private Cloud Security Considerations",
        "url": "https://csrc.nist.gov/publications/detail/sp/800-144/final",
        "type": "article"
      }
    ]
  }