{
    "id": "public-cloud",
    "categoryId": "cloud",
    "title": "Public Cloud Platforms",
    "description": "Public cloud platforms provide computing resources—including servers, storage, databases, networking, software, and analytics—over the internet from cloud service providers who own and manage all the hardware, software, and supporting infrastructure.",
    "sections": [
      {
        "id": "aws",
        "title": "Amazon Web Services (AWS)",
        "description": "AWS offers a broad set of cloud services, including compute, storage, databases, machine learning, and more"
      },
      {
        "id": "azure",
        "title": "Microsoft Azure",
        "description": "Microsoft's cloud platform with strong integration with Windows and Microsoft enterprise software"
      },
      {
        "id": "gcp",
        "title": "Google Cloud Platform (GCP)",
        "description": "Google's cloud offering with strengths in data analytics, machine learning, and container technologies"
      },
      {
        "id": "other-clouds",
        "title": "Other Public Cloud Providers",
        "description": "Alternative cloud platforms offering various specializations and regional focus"
      },
      {
        "id": "cloud-storage",
        "title": "Cloud Storage Services",
        "description": "Services for storing and retrieving data in the cloud"
      }
    ],
    "bestPractices": [
      "**Well-Architected Framework**: Follow cloud provider best practices for security, reliability, performance, and cost optimization",
      "**Identity and Access Management**: Implement least privilege principles and strong authentication mechanisms",
      "**Resource Tagging**: Tag all resources for cost allocation, ownership, and lifecycle management",
      "**Network Security**: Design secure network architecture with appropriate segmentation and controls",
      "**Cost Management**: Monitor and optimize costs through rightsizing, reserved instances, and spot instances",
      "**Multi-region Deployment**: Design for high availability across multiple regions when appropriate",
      "**Service Limits**: Be aware of service quotas and request increases before they impact operations",
      "**Automation**: Use infrastructure as code and CI/CD pipelines for consistent deployments"
    ],
    "integrations": [
      "**DevOps Tools**: CI/CD pipelines for deploying applications to cloud environments",
      "**Monitoring Solutions**: Cloud-native monitoring integrated with existing observability tools",
      "**Identity Providers**: Integration with corporate directory services and SSO solutions",
      "**Data Platforms**: ETL tools and data warehouses connecting to cloud storage and databases",
      "**Security Tools**: SIEM, vulnerability scanning, and compliance solutions"
    ],
    "resources": [
      {
        "title": "AWS Well-Architected Framework",
        "url": "https://aws.amazon.com/architecture/well-architected/",
        "type": "documentation"
      },
      {
        "title": "Azure Architecture Center",
        "url": "https://docs.microsoft.com/en-us/azure/architecture/",
        "type": "documentation"
      },
      {
        "title": "Google Cloud Architecture Framework",
        "url": "https://cloud.google.com/architecture/framework",
        "type": "documentation"
      },
      {
        "title": "The Cloud Adoption Framework",
        "url": "https://docs.microsoft.com/en-us/azure/cloud-adoption-framework/",
        "type": "documentation"
      },
      {
        "title": "Cloud Architecture Patterns",
        "url": "https://www.oreilly.com/library/view/cloud-architecture-patterns/9781449357979/",
        "type": "book"
      }
    ]
  }