{
    "id": "ci-cd",
    "categoryId": "devops-infrastructure",
    "title": "Continuous Integration & Continuous Delivery",
    "description": "CI/CD tools automate the building, testing, and deployment of code changes, enabling faster and more reliable software delivery with fewer manual steps.",
    "sections": [
      {
        "id": "ci-platforms",
        "title": "CI Platforms & Services",
        "description": "Complete platforms for automating builds, tests, and deployment pipelines"
      },
      {
        "id": "build-tools",
        "title": "Build Automation Tools",
        "description": "Tools for compiling, building, and packaging software"
      },
      {
        "id": "deployment-tools",
        "title": "Deployment & Release Tools",
        "description": "Specialized tools for deploying code to production and managing releases"
      },
      {
        "id": "testing-frameworks",
        "title": "Testing Frameworks & Tools",
        "description": "Tools for automated testing as part of the CI/CD pipeline"
      }
    ],
    "bestPractices": [
      "**Build once, deploy many times** to ensure the same artifact is promoted across environments",
      "**Automate everything** including builds, tests, and deployments to reduce human error",
      "**Test early and often** with a combination of unit, integration, and end-to-end tests",
      "**Implement trunk-based development** with short-lived feature branches for faster integration",
      "**Use feature flags** to deploy inactive code that can be enabled without a new deployment",
      "**Maintain a deployment pipeline** with staging environments that mirror production",
      "**Practice blue/green deployments** to reduce downtime and risk during releases"
    ],
    "integrations": [
      "**Source Control** triggers builds automatically when code is pushed",
      "**Infrastructure as Code** provisions consistent environments for testing and deployment",
      "**Container Registries** store versioned Docker images for deployment",
      "**Monitoring Tools** provide feedback on application performance after deployment",
      "**Issue Tracking** links releases to resolved tickets and features"
    ],
    "resources": [
      {
        "title": "CI/CD Pipeline: A Complete Guide",
        "url": "https://www.atlassian.com/continuous-delivery/principles/continuous-integration-vs-delivery-vs-deployment",
        "type": "article"
      },
      {
        "title": "The DevOps Handbook",
        "url": "https://itrevolution.com/book/the-devops-handbook/",
        "type": "book"
      },
      {
        "title": "Continuous Delivery: Reliable Software Releases through Build, Test, and Deployment Automation",
        "url": "https://continuousdelivery.com/",
        "type": "book"
      },
      {
        "title": "Google Cloud CI/CD Documentation",
        "url": "https://cloud.google.com/solutions/continuous-integration",
        "type": "documentation"
      }
    ]
  }